{
  "schemaVersion": 1,
  "mode": "hotseat",
  "players": [
    {
      "id": "p1",
      "label": "P1"
    },
    {
      "id": "p2",
      "label": "P2"
    },
    {
      "id": "p3",
      "label": "P3"
    },
    {
      "id": "p4",
      "label": "P4"
    }
  ],
  "hotseat": {
    "turns": 8,
    "pointsCycle": [
      1,
      2,
      3,
      2
    ]
  }
}
